{
  "schema_version": 1,
  "status": "approved",
  "skill_id": "architectural-assembly-reveal",
  "display_name": "建筑特写至全貌动态组装视频",
  "sources": [
    {
      "name": "建筑特写至全貌拆解组装动画视频提示词生成 Skill.md",
      "source_label": "建筑特写至全貌拆解组装动画视频提示词生成 Skill.md",
      "encoding": "utf-8-sig",
      "sha256": "04a33d9ce95081a6923bf5ec3f3c15fbebf223e31ad04f8342b2562635948bbd"
    }
  ],
  "duplicate_check": {
    "classification": "new",
    "matches": [],
    "optional_sources_missing": []
  },
  "extraction_summary": {
    "contract_items": 1,
    "creative_guidance_items": 1,
    "community_experience_items": 1,
    "failure_cases": 1,
    "positive_examples": 1,
    "negative_examples": 1,
    "boundary_examples": 1
  },
  "reference_summary": [
    {
      "id": "assembly-frames",
      "media_type": "image",
      "role": "end_frame",
      "description": "按镜头顺序提供的建筑参考图，每张图作为对应镜头最后一刻必须抵达的绝对尾帧",
      "required": true,
      "min_count": 1,
      "max_count": 6,
      "ordered": true,
      "observation_required": true,
      "count_rule": {
        "type": "duration_formula",
        "enforcement": "required",
        "fixed_count": null,
        "seconds_per_item": 5,
        "rounding": "ceil",
        "duration_share": 1,
        "duration_to_count": [],
        "provenance": "source_explicit",
        "confidence": "high",
        "rationale": "原始 Skill 明确每完整五秒使用一张尾帧参考，剩余不足五秒仍增加一张。"
      }
    }
  ],
  "isolated_legacy_content": [
    {
      "code": "NONSTANDARD_METADATA",
      "message": "Source does not use standard YAML frontmatter"
    }
  ],
  "creative_supplement": {
    "status": "user_approved",
    "generated_by": "Codex_DT",
    "request_path": "dt-request.json",
    "draft_path": "review/dt-creative-supplement.draft.json",
    "requires_user_review": false,
    "reason": "User approved the validated DT creative supplement and it was merged into references."
  },
  "contract_conflicts": [],
  "blocking_questions": [],
  "validation_issues": [],
  "experience_preservation": {
    "source_claims_accounted_for": true,
    "notes": "Cleaned legacy source experience is preserved in references for review; examples do not define the contract."
  },
  "user_approval": {
    "required": true,
    "approved": true
  },
  "pacing_rule_summary": [
    {
      "slot_id": "assembly-frames",
      "type": "duration_formula",
      "enforcement": "required",
      "fixed_count": null,
      "seconds_per_item": 5,
      "rounding": "ceil",
      "duration_share": 1,
      "duration_to_count": [],
      "provenance": "source_explicit",
      "confidence": "high",
      "rationale": "原始 Skill 明确每完整五秒使用一张尾帧参考，剩余不足五秒仍增加一张。",
      "min_count": 1,
      "max_count": 6
    }
  ]
}
